{
  "specversion": "1.0",
  "id": "b2c3d4e5-f6a7-8901-bcde-f12345678901",
  "source": "urn:gluendo:hr:workday",
  "type": "gluendo.hr.employee.updated",
  "time": "2026-03-18T14:15:00Z",
  "datacontenttype": "application/json",
  "traceparent": "00-5cf92f3577b34da6a3ce929d0e0e4736-11f067aa0ba902b7-01",
  "changedfields": ["position", "department"],
  "etag": "\"7a3f9c12\"",
  "dataschema": "https://gluendo.github.io/schema-registry/schemas/domains/hr/employee/v1.0.0/employee.schema.json",
  "data": {
    "employeeId": "EMP-12345",
    "position": "Principal Engineer",
    "department": "Platform"
  }
}
