{
  "specversion": "1.0",
  "id": "c3d4e5f6-a7b8-9012-cdef-123456789012",
  "source": "urn:gluendo:hr:workday",
  "type": "gluendo.hr.employee.updated",
  "time": "2026-03-18T14:15:00Z",
  "datacontenttype": "application/json",
  "traceparent": "00-6df92f3577b34da6a3ce929d0e0e4736-22f067aa0ba902b7-01",
  "changedfields": ["position", "department"],
  "etag": "\"7a3f9c12\"",
  "dataschema": "https://gluendo.github.io/schema-registry/schemas/domains/hr/employee/v1.0.0/employee.schema.json",
  "data": {
    "employeeId": "EMP-12345"
  }
}
